{
  "id": "SYM-SEC-001",
  "slug": "virus-malware",
  "name": "Virus o malware",
  "category": "Seguridad",
  "severity": "high",
  "description": "El equipo muestra alertas, ventanas extrañas, redirecciones, procesos desconocidos o comportamiento sospechoso.",
  "relatedCauses": [
    "alerta-defender",
    "archivo-sospechoso",
    "sintomas-sin-deteccion",
    "amenaza-persistente"
  ],
  "questions": [
    "Q-SEC-001"
  ],
  "status": "active",
  "version": "1.0.0"
}